{
  "$id": "page.schema.json",
  "$schema": "http://json-schema.org/draft-07/schema#",
  "title": "Page",
  "type": "object",
  "additionalProperties": false,
  "required": ["schemaVersion", "name", "title", "type", "layout", "published", "sections"],
  "properties": {
    "schemaVersion": { "type": "integer", "minimum": 1 },
    "name": { "type": "string", "minLength": 1 },
    "title": { "type": "string", "minLength": 1 },
    "type": { "type": "string", "minLength": 1 },
    "layout": { "type": "string", "minLength": 1 },
    "published": { "type": "boolean" },
    "author": { "type": "string", "minLength": 1 },
    "publishDate": { "type": "string", "minLength": 1 },
    "tags": {
      "type": "array",
      "items": { "type": "string", "minLength": 1 }
    },
    "sections": {
      "type": "array",
      "items": { "$ref": "instance.schema.json" }
    }
  }
}
