{
  "schemaVersion": 7,
  "name": "Page not found",
  "title": "Page not found — Granite CMS",
  "type": "page",
  "layout": "theme",
  "published": true,
  "sections": [
    {
      "id": "sec-hero",
      "type": "hero",
      "settings": {
        "eyebrow": "404",
        "heading": "This page didn't make it into the build.",
        "subheading": "The page you're looking for doesn't exist, or has moved. Check the URL, or head back to solid ground."
      },
      "blocks": [
        { "id": "blk-home", "type": "button", "settings": { "label": "Back to home", "url": "/", "style": "primary" } },
        { "id": "blk-docs", "type": "button", "settings": { "label": "View the docs", "url": "/docs", "style": "secondary" } }
      ]
    }
  ]
}
